{
  "schemaVersion": "2.2",
  "subdivision": "sd_01J9ZD00000000000000000001",
  "dataVersion": 1,
  "generatedAt": "2040-06-01T08:00:00.000Z",
  "highlights": [
    {
      "id": "hl_01J9ZD00000000000000000001",
      "name": "Taverna Vathi",
      "category": "food",
      "importance": 2,
      "position": {
        "lat": 35.12833,
        "lon": 21.13
      },
      "spotIds": [
        "sp_01J9ZD00000000000000000001",
        "sp_01J9ZD00000000000000000002"
      ],
      "regionId": "rg_01J9ZD00000000000000000001",
      "season": null,
      "externalRefs": {
        "googlePlaceId": null,
        "osmId": null,
        "wikidataId": null
      },
      "score": {
        "confidence": 0.6,
        "sourcesCount": 0,
        "lastObserved": null
      },
      "profileVersion": 1,
      "validFrom": "2040-06-01"
    }
  ]
}
